{
  "version": 1,
  "mode": "partner-led",
  "spec": {
    "source": "native",
    "paths": [
      "/Users/khalidalzahrani/Desktop/CodingSpace/tickmarkr/specs/2.1.7-the-board-and-the-latch.spec.md"
    ],
    "hash": "6adcfff8ac8e4964f7abded3f272446a0c24c1e02a36702d70070ae1b75f05a9"
  },
  "tasks": [
    {
      "id": "T1",
      "title": "the board fits the pane it is given",
      "goal": "The columnar gate table survives at the width the board actually gets. The floor that chooses\ncolumnar over stacked becomes one exported constant read by the arithmetic; it is lowered so a\n96-column board renders columnar. The stacked branch stays reachable for genuinely narrow panes. The\nwatch loop enters and leaves the alternate screen buffer so a long run stops turning every frame into\npermanent scrollback. Both changes are unconditional. The gate vocabulary is a closed list and is not\ntouched here.",
      "shape": "implement",
      "complexity": 6,
      "deps": [],
      "files": [
        "src/cli/commands/status.ts",
        "tests/cli/status-watch.test.ts",
        "tests/cli/{status,status-brand,status-oneline,status-liveness,status-live-phase,status-board-deps,status-board-effort,status-graph-hash,status-watch-beat,status-watch-purity}.test.ts"
      ],
      "context": [
        "src/drivers/herdr.ts",
        "docs/codebase/ARCHITECTURE.md",
        "tests/watch-context.test.ts"
      ],
      "acceptance": [
        {
          "oracle": "test",
          "test": "`taskBox` renders the columnar gate table at 96 columns; at 40 columns it still renders stacked cards so the narrow fallback survives the change"
        },
        {
          "oracle": "test",
          "test": "the columnar floor is one exported constant; raising it above the rendered width returns stacked cards so the floor is a value rather than a literal buried in the arithmetic"
        },
        {
          "oracle": "test",
          "test": "the watch loop emits the alternate-screen enter sequence before its first frame; a one-shot status emits neither sequence so the non-watch surface is unchanged"
        },
        {
          "oracle": "judge",
          "text": "the diff lowers the exported floor unconditionally while keeping the stacked branch reachable so no pane width loses its rendering"
        }
      ],
      "gates": [
        "build",
        "test",
        "lint",
        "evidence",
        "scope",
        "acceptance",
        "review"
      ],
      "humanGate": false,
      "status": "done",
      "evidence": {
        "commits": [
          "4a08ba68ef4fd5c0cb252cd39d0f6d5d3a2ebb5b",
          "f476697b84836e92272fd2d78aab9869eec79e9a",
          "5cc95ac32619444ed98e81710a7b312bc5d77355",
          "736a54b8052970b51558810972d3152f00781926",
          "2f1a4da362ad2778536233c648bc1acdc18a0792",
          "cc48b2f46e2c2ce5e934b2f93d6e7cf16925f379"
        ],
        "artifacts": [
          "/Users/khalidalzahrani/Desktop/CodingSpace/tickmarkr/.tickmarkr/runs/run-20260829-010749-0000000000003010/prompts/T1-a0.md",
          "/Users/khalidalzahrani/Desktop/CodingSpace/tickmarkr/.tickmarkr/runs/run-20260829-010749-0000000000003010/prompts/T1-a1.md",
          "/Users/khalidalzahrani/Desktop/CodingSpace/tickmarkr/.tickmarkr/runs/run-20260829-010749-0000000000003010/prompts/T1-a2.md"
        ],
        "gateResults": [
          {
            "gate": "build",
            "pass": true,
            "details": "exit 0",
            "capacity": {
              "forkCap": 3,
              "cores": 18
            },
            "meta": {
              "durationMs": 1704,
              "load1Start": 5.89404296875,
              "load1End": 5.89404296875
            },
            "taskContentDigest": "6dceed856689a2f370871007558389cd5677130a1e0f54a5b87c74a54e4e1927"
          },
          {
            "gate": "test",
            "pass": true,
            "details": "exit 0",
            "capacity": {
              "forkCap": 3,
              "cores": 18
            },
            "meta": {
              "selectedTests": [
                "tests/cli/approve-deferred.test.ts",
                "tests/cli/beat.test.ts",
                "tests/cli/cli.test.ts",
                "tests/cli/index.test.ts",
                "tests/cli/stats.test.ts",
                "tests/cli/status-board-deps.test.ts",
                "tests/cli/status-board-effort.test.ts",
                "tests/cli/status-brand.test.ts",
                "tests/cli/status-graph-hash.test.ts",
                "tests/cli/status-live-phase.test.ts",
                "tests/cli/status-liveness.test.ts",
                "tests/cli/status-oneline.test.ts",
                "tests/cli/status-watch-beat.test.ts",
                "tests/cli/status-watch-purity.test.ts",
                "tests/cli/status-watch.test.ts",
                "tests/cli/status.test.ts",
                "tests/cli/version.test.ts",
                "tests/cockpit/live.test.ts",
                "tests/e2e/orca-smoke.e2e.test.ts",
                "tests/plan/scope.test.ts",
                "tests/run/daemon/fleet-and-gates.test.ts",
                "tests/run/lock.test.ts",
                "tests/run/resume-graph-hash.test.ts",
                "tests/run/supervision-arming.test.ts",
                "tests/watch-context.test.ts"
              ],
              "durationMs": 39639,
              "load1Start": 5.89404296875,
              "load1End": 6.18505859375,
              "selectedDurationMs": 39639
            },
            "taskContentDigest": "6dceed856689a2f370871007558389cd5677130a1e0f54a5b87c74a54e4e1927"
          },
          {
            "gate": "lint",
            "pass": true,
            "details": "exit 0",
            "capacity": {
              "forkCap": 3,
              "cores": 18
            },
            "meta": {
              "durationMs": 137,
              "load1Start": 6.18505859375,
              "load1End": 6.18505859375
            },
            "taskContentDigest": "6dceed856689a2f370871007558389cd5677130a1e0f54a5b87c74a54e4e1927"
          },
          {
            "gate": "evidence",
            "pass": true,
            "details": "1 commit(s):\nsrc/cli/commands/status.ts     | 30 ++++++++++++++++++--\n tests/cli/status-brand.test.ts |  4 +--\n tests/cli/status-watch.test.ts | 64 +++++++++++++++++++++++++++++++++++++++++-\n 3 files changed, 92 insertions(+), 6 deletions(-)",
            "meta": {
              "durationMs": 73,
              "load1Start": 5.89404296875,
              "load1End": 6.18505859375
            },
            "taskContentDigest": "6dceed856689a2f370871007558389cd5677130a1e0f54a5b87c74a54e4e1927"
          },
          {
            "gate": "scope",
            "pass": true,
            "details": "all 3 changed files in scope",
            "meta": {
              "durationMs": 41,
              "load1Start": 5.89404296875,
              "load1End": 6.18505859375
            },
            "taskContentDigest": "6dceed856689a2f370871007558389cd5677130a1e0f54a5b87c74a54e4e1927"
          },
          {
            "gate": "acceptance",
            "pass": false,
            "details": "oracle failed: test \"`taskBox` renders the columnar gate table at 96 columns; at 40 columns it still renders stacked cards so the narrow fallback survives the change\" — name filter matched zero tests (filter: `taskBox` renders the columnar gate table at 96 columns; at 40 columns it still renders stacked cards so the narrow fallback survives the change)\n ↓ |built-cli| tests/cli/cli.test.ts (39 tests | 39 skipped)\n ↓ |built-cli| tests/cli/bin.test.ts (8 tests | 8 skipped)\n ↓ |built-cli| tests/cli/version.test.ts (15 tests | 15 skipped)\n\n Test Files  267 skipped (267)\n      Tests  3638 skipped (3638)\n   Start at  04:26:54\n   Duration  19.59s (transform 2.55s, setup 14.19s, collect 14.74s, tests 0ms, environment 18ms, prepare 6.53s)",
            "meta": {
              "durationMs": 20027,
              "load1Start": 6.18505859375,
              "load1End": 8.49462890625
            },
            "taskContentDigest": "6dceed856689a2f370871007558389cd5677130a1e0f54a5b87c74a54e4e1927"
          },
          {
            "gate": "review",
            "pass": true,
            "details": "reviewer kimi:kimi-code/k3 (moonshot): approved (2 deferred)\n- [deferred/minor] gateTableLayout's injectable `floor` parameter exists solely for the test; production always calls it with the default. A test-only seam, but harmless andit keeps the constant honest. — rationale: Testability seam only; production behavior uses the exported constant and is covered by the 96/40-column rendering test.\n- [deferred/minor] Enter sequence is written before the try block, so a throw from the enter write itself would skip the leave; in practice nothing between the write and try can throw, and an EPIPE there means the terminal is gone anyway. — rationale: Unreachable-in-practice edge; not worth restructuring the watch setup.",
            "meta": {
              "policy": "full",
              "reviewer": "kimi:kimi-code/k3",
              "invocations": [
                {
                  "channel": "kimi:kimi-code/k3",
                  "durationMs": 190783
                }
              ],
              "durationMs": 191665,
              "load1Start": 6.18505859375,
              "load1End": 18.88525390625
            },
            "taskContentDigest": "6dceed856689a2f370871007558389cd5677130a1e0f54a5b87c74a54e4e1927"
          },
          {
            "gate": "build",
            "pass": true,
            "details": "exit 0",
            "capacity": {
              "forkCap": 3,
              "cores": 18
            },
            "meta": {
              "durationMs": 1690,
              "load1Start": 5.5478515625,
              "load1End": 5.6640625
            },
            "taskContentDigest": "6dceed856689a2f370871007558389cd5677130a1e0f54a5b87c74a54e4e1927"